15:35:11.399326 IP (tos 0x0, ttl 64, id 49718, offset 0, flags [DF], proto TCP (6), length 60)
    10.70.10.108.663 > 10.70.10.110.2049: Flags [S], cksum 0x2994 (incorrect -> 0x238a), seq 1426805590, win 64240, options [mss 1460,sackOK,TS val 2189478565 ecr 0,nop,wscale 7], length 0
15:35:11.399865 IP (tos 0x0, ttl 64, id 0, offset 0, flags [DF], proto TCP (6), length 60)
    10.70.10.110.2049 > 10.70.10.108.663: Flags [S.], cksum 0x2291 (correct), seq 981378226, ack 1426805591, win 65160, options [mss 1460,sackOK,TS val 1164564661 ecr 2189478565,nop,wscale 7], length 0
15:35:11.399932 IP (tos 0x0, ttl 64, id 49719, offset 0, flags [DF], proto TCP (6), length 52)
    10.70.10.108.663 > 10.70.10.110.2049: Flags [.], cksum 0x298c (incorrect -> 0x4def), seq 1, ack 1, win 502, options [nop,nop,TS val 2189478566 ecr 1164564661], length 0
15:35:11.400241 IP (tos 0x0, ttl 64, id 49720, offset 0, flags [DF], proto TCP (6), length 148)
    10.70.10.108.663 > 10.70.10.110.2049: Flags [P.], cksum 0x29ec (incorrect -> 0x8e6f), seq 1:97, ack 1, win 502, options [nop,nop,TS val 2189478566 ecr 1164564661], length 96: NFS request xid 1749065711 92 getattr fh Unkno/2F7372762F6E66732F7368617265646661726964
15:35:11.400438 IP (tos 0x0, ttl 64, id 18987, offset 0, flags [DF], proto TCP (6), length 52)
    10.70.10.110.2049 > 10.70.10.108.663: Flags [.], cksum 0x4d87 (correct), seq 1, ack 97, win 509, options [nop,nop,TS val 1164564662 ecr 2189478566], length 0
15:35:11.400438 IP (tos 0x0, ttl 64, id 18988, offset 0, flags [DF], proto TCP (6), length 120)
    10.70.10.110.2049 > 10.70.10.108.663: Flags [P.], cksum 0x60f1 (correct), seq 1:69, ack 97, win 509, options [nop,nop,TS val 1164564662 ecr 2189478566], length 68: NFS reply xid 1749065711 reply ok 64 getattr unk-ft 24  102000000 ids 0/-2013258240 sz 52368278
15:35:11.400488 IP (tos 0x0, ttl 64, id 49721, offset 0, flags [DF], proto TCP (6), length 52)
    10.70.10.108.663 > 10.70.10.110.2049: Flags [.], cksum 0x298c (incorrect -> 0x4d4a), seq 97, ack 69, win 502, options [nop,nop,TS val 2189478566 ecr 1164564662], length 0
15:35:11.401076 IP (tos 0x0, ttl 64, id 31994, offset 0, flags [DF], proto TCP (6), length 60)
    10.70.10.108.896 > 10.70.10.110.2049: Flags [S], cksum 0x2994 (incorrect -> 0x7186), seq 2156255476, win 64240, options [mss 1460,sackOK,TS val 2189478567 ecr 0,nop,wscale 7], length 0
15:35:11.401463 IP (tos 0x0, ttl 64, id 0, offset 0, flags [DF], proto TCP (6), length 60)
    10.70.10.110.2049 > 10.70.10.108.896: Flags [S.], cksum 0x97ee (correct), seq 2771849878, ack 2156255477, win 65160, options [mss 1460,sackOK,TS val 1164564663 ecr 2189478567,nop,wscale 7], length 0
15:35:11.401510 IP (tos 0x0, ttl 64, id 31995, offset 0, flags [DF], proto TCP (6), length 52)
    10.70.10.108.896 > 10.70.10.110.2049: Flags [.], cksum 0x298c (incorrect -> 0xc34d), seq 1, ack 1, win 502, options [nop,nop,TS val 2189478567 ecr 1164564663], length 0
15:35:11.401971 IP (tos 0x0, ttl 64, id 31996, offset 0, flags [DF], proto TCP (6), length 188)
    10.70.10.108.896 > 10.70.10.110.2049: Flags [P.], cksum 0x2a14 (incorrect -> 0x3855), seq 1:137, ack 1, win 502, options [nop,nop,TS val 2189478568 ecr 1164564663], length 136: NFS request xid 1749065711 132 mkdir fh Unknow/0108000088001E000000000088001E0000000000031F1396 "dir2"
15:35:11.402165 IP (tos 0x0, ttl 64, id 44624, offset 0, flags [DF], proto TCP (6), length 52)
    10.70.10.110.2049 > 10.70.10.108.896: Flags [.], cksum 0xc2be (correct), seq 1, ack 137, win 508, options [nop,nop,TS val 1164564663 ecr 2189478568], length 0
15:35:11.402454 IP (tos 0x0, ttl 64, id 44625, offset 0, flags [DF], proto TCP (6), length 200)
    10.70.10.110.2049 > 10.70.10.108.896: Flags [P.], cksum 0x1e9c (correct), seq 1:149, ack 137, win 508, options [nop,nop,TS val 1164564664 ecr 2189478568], length 148: NFS reply xid 1749065711 reply ok 144 getattr ERROR: File exists
15:35:11.402476 IP (tos 0x0, ttl 64, id 31997, offset 0, flags [DF], proto TCP (6), length 52)
    10.70.10.108.896 > 10.70.10.110.2049: Flags [.], cksum 0x298c (incorrect -> 0xc230), seq 137, ack 149, win 501, options [nop,nop,TS val 2189478568 ecr 1164564664], length 0
15:35:11.402845 IP (tos 0x0, ttl 64, id 31998, offset 0, flags [DF], proto TCP (6), length 160)
    10.70.10.108.896 > 10.70.10.110.2049: Flags [P.], cksum 0x29f8 (incorrect -> 0x3978), seq 137:245, ack 149, win 501, options [nop,nop,TS val 2189478569 ecr 1164564664], length 108: NFS request xid 1749065711 104 lookup fh Unknow/0108000088001E000000000088001E0000000000031F1396 "dir2"
15:35:11.403085 IP (tos 0x0, ttl 64, id 44626, offset 0, flags [DF], proto TCP (6), length 52)
    10.70.10.110.2049 > 10.70.10.108.896: Flags [.], cksum 0xc1bc (correct), seq 149, ack 245, win 508, options [nop,nop,TS val 1164564664 ecr 2189478569], length 0
15:35:11.403352 IP (tos 0x0, ttl 64, id 44627, offset 0, flags [DF], proto TCP (6), length 292)
    10.70.10.110.2049 > 10.70.10.108.896: Flags [P.], cksum 0x662c (correct), seq 149:389, ack 245, win 508, options [nop,nop,TS val 1164564665 ecr 2189478569], length 240: NFS reply xid 1749065711 reply ok 236 getattr unk-ft 25  102000000 ids 0/-1996481024 sz 69145494
15:35:11.403383 IP (tos 0x0, ttl 64, id 31999, offset 0, flags [DF], proto TCP (6), length 52)
    10.70.10.108.896 > 10.70.10.110.2049: Flags [.], cksum 0x298c (incorrect -> 0xc0d2), seq 245, ack 389, win 501, options [nop,nop,TS val 2189478569 ecr 1164564665], length 0
15:35:11.403859 IP (tos 0x0, ttl 64, id 32000, offset 0, flags [DF], proto TCP (6), length 200)
    10.70.10.108.896 > 10.70.10.110.2049: Flags [P.], cksum 0x2a20 (incorrect -> 0x87e2), seq 245:393, ack 389, win 501, options [nop,nop,TS val 2189478570 ecr 1164564665], length 148: NFS request xid 1749065711 144 create fh Unknow/0108000089001E000000000089001E0000000000041F1396  [|nfs]
15:35:11.404213 IP (tos 0x0, ttl 64, id 44628, offset 0, flags [DF], proto TCP (6), length 52)
    10.70.10.110.2049 > 10.70.10.108.896: Flags [.], cksum 0xc037 (correct), seq 389, ack 393, win 507, options [nop,nop,TS val 1164564665 ecr 2189478570], length 0
15:35:11.404446 IP (tos 0x0, ttl 64, id 44629, offset 0, flags [DF], proto TCP (6), length 324)
    10.70.10.110.2049 > 10.70.10.108.896: Flags [P.], cksum 0x2073 (correct), seq 389:661, ack 393, win 507, options [nop,nop,TS val 1164564666 ecr 2189478570], length 272: NFS reply xid 1749065711 reply ok 268 getattr REG 32 ids -1979703808/0 sz 9943980962582888448
15:35:11.404484 IP (tos 0x0, ttl 64, id 32001, offset 0, flags [DF], proto TCP (6), length 52)
    10.70.10.108.896 > 10.70.10.110.2049: Flags [.], cksum 0x298c (incorrect -> 0xbf2c), seq 393, ack 661, win 501, options [nop,nop,TS val 2189478570 ecr 1164564666], length 0
15:35:11.404922 IP (tos 0x0, ttl 64, id 32002, offset 0, flags [DF], proto TCP (6), length 200)
    10.70.10.108.896 > 10.70.10.110.2049: Flags [P.], cksum 0x2a20 (incorrect -> 0x8f68), seq 393:541, ack 661, win 501, options [nop,nop,TS val 2189478571 ecr 1164564666], length 148: NFS request xid 1749065711 144 write fh Unknow/010800008A001E00000000008A001E0000000000051F1396 1 (0) bytes @ 10922354996280295424 <#21>
15:35:11.405061 IP (tos 0x0, ttl 64, id 44630, offset 0, flags [DF], proto TCP (6), length 52)
    10.70.10.110.2049 > 10.70.10.108.896: Flags [.], cksum 0xbe92 (correct), seq 661, ack 541, win 506, options [nop,nop,TS val 1164564666 ecr 2189478571], length 0
15:35:11.439050 IP (tos 0x0, ttl 64, id 44631, offset 0, flags [DF], proto TCP (6), length 216)
    10.70.10.110.2049 > 10.70.10.108.896: Flags [P.], cksum 0xb33c (correct), seq 661:825, ack 541, win 506, options [nop,nop,TS val 1164564700 ecr 2189478571], length 164: NFS reply xid 1749065711 reply ok 160 getattr REG 0 ids 1749065711/0 sz 7512180027299987456
15:35:11.439084 IP (tos 0x0, ttl 64, id 32003, offset 0, flags [DF], proto TCP (6), length 52)
    10.70.10.108.896 > 10.70.10.110.2049: Flags [.], cksum 0x298c (incorrect -> 0xbdaf), seq 541, ack 825, win 501, options [nop,nop,TS val 2189478605 ecr 1164564700], length 0
15:35:12.440674 IP (tos 0x0, ttl 64, id 32004, offset 0, flags [DF], proto TCP (6), length 200)
    10.70.10.108.896 > 10.70.10.110.2049: Flags [P.], cksum 0x2a20 (incorrect -> 0x7fd5), seq 541:689, ack 825, win 501, options [nop,nop,TS val 2189479606 ecr 1164564700], length 148: NFS request xid 1749065712 144 create fh Unknow/0108000089001E000000000089001E0000000000041F1396  [|nfs]
15:35:12.441111 IP (tos 0x0, ttl 64, id 44632, offset 0, flags [DF], proto TCP (6), length 52)
    10.70.10.110.2049 > 10.70.10.108.896: Flags [.], cksum 0xb544 (correct), seq 825, ack 689, win 505, options [nop,nop,TS val 1164565702 ecr 2189479606], length 0
15:35:12.441424 IP (tos 0x0, ttl 64, id 44633, offset 0, flags [DF], proto TCP (6), length 324)
    10.70.10.110.2049 > 10.70.10.108.896: Flags [P.], cksum 0x137a (correct), seq 825:1097, ack 689, win 505, options [nop,nop,TS val 1164565703 ecr 2189479606], length 272: NFS reply xid 1749065712 reply ok 268 create fh Unknow/010800008B001E00000000008B001E0000000000051F1396 REG 1 ids 1/6120 sz 129458904236032 nlink 33277 rdev 0/0 fsid 0 fileid 80100000000 a/m/ctime 1966219.1749051448 0.1749065712 0.1749065712 dir attr: PRE: POST: NON 10000 ids 0/1749051451 sz 1 nlink 1749051451 rdev 2/6120 fsid 75be00000000 fileid 100000000000 a/m/ctime 4096.000000 0.000000 2049.000000
15:35:12.441463 IP (tos 0x0, ttl 64, id 32005, offset 0, flags [DF], proto TCP (6), length 52)
    10.70.10.108.896 > 10.70.10.110.2049: Flags [.], cksum 0x298c (incorrect -> 0xb436), seq 689, ack 1097, win 501, options [nop,nop,TS val 2189479607 ecr 1164565703], length 0
15:35:12.441944 IP (tos 0x0, ttl 64, id 32006, offset 0, flags [DF], proto TCP (6), length 200)
    10.70.10.108.896 > 10.70.10.110.2049: Flags [P.], cksum 0x2a20 (incorrect -> 0x816f), seq 689:837, ack 1097, win 501, options [nop,nop,TS val 2189479608 ecr 1164565703], length 148: NFS request xid 1749065712 144 write fh Unknow/010800008B001E00000000008B001E0000000000051F1396 1 (0) bytes @ 10922636471257006080 <#21>
15:35:12.442347 IP (tos 0x0, ttl 64, id 44634, offset 0, flags [DF], proto TCP (6), length 52)
    10.70.10.110.2049 > 10.70.10.108.896: Flags [.], cksum 0xb39d (correct), seq 1097, ack 837, win 504, options [nop,nop,TS val 1164565704 ecr 2189479608], length 0
15:35:12.473233 IP (tos 0x0, ttl 64, id 44635, offset 0, flags [DF], proto TCP (6), length 216)
    10.70.10.110.2049 > 10.70.10.108.896: Flags [P.], cksum 0xa844 (correct), seq 1097:1261, ack 837, win 504, options [nop,nop,TS val 1164565734 ecr 2189479608], length 164: NFS reply xid 1749065712 reply ok 160 create fh / dir attr: PRE: sz 1749065712 mtime 0.000001 ctime 1.033277 POST: unk-ft 6120  72676 ids 21/0 sz 17592186044416 nlink 0 rdev 2049/0 fsid 1e008b68406838 fileid 68409ff0 a/m/ctime 0.1749065712 0.000021 2.2466250752
15:35:12.473265 IP (tos 0x0, ttl 64, id 32007, offset 0, flags [DF], proto TCP (6), length 52)
    10.70.10.108.896 > 10.70.10.110.2049: Flags [.], cksum 0x298c (incorrect -> 0xb2bf), seq 837, ack 1261, win 501, options [nop,nop,TS val 2189479639 ecr 1164565734], length 0
15:35:13.474843 IP (tos 0x0, ttl 64, id 32008, offset 0, flags [DF], proto TCP (6), length 200)
    10.70.10.108.896 > 10.70.10.110.2049: Flags [P.], cksum 0x2a20 (incorrect -> 0x73e2), seq 837:985, ack 1261, win 501, options [nop,nop,TS val 2189480641 ecr 1164565734], length 148: NFS request xid 1749065713 144 create fh Unknow/0108000089001E000000000089001E0000000000041F1396  [|nfs]
15:35:13.475240 IP (tos 0x0, ttl 64, id 44636, offset 0, flags [DF], proto TCP (6), length 52)
    10.70.10.110.2049 > 10.70.10.108.896: Flags [.], cksum 0xaa55 (correct), seq 1261, ack 985, win 503, options [nop,nop,TS val 1164566736 ecr 2189480641], length 0
15:35:13.475510 IP (tos 0x0, ttl 64, id 44637, offset 0, flags [DF], proto TCP (6), length 324)
    10.70.10.110.2049 > 10.70.10.108.896: Flags [P.], cksum 0x0688 (correct), seq 1261:1533, ack 985, win 503, options [nop,nop,TS val 1164566737 ecr 2189480641], length 272: NFS reply xid 1749065713 reply ok 268 create fh Unknow/010800008C001E00000000008C001E0000000000051F1396 REG 1 ids 1/6120 sz 129458904236032 nlink 33277 rdev 0/0 fsid 0 fileid 80100000000 a/m/ctime 1966220.1749051450 0.1749065713 0.1749065713 dir attr: PRE: POST: NON 10000 ids 0/1749051451 sz 1 nlink 1749051451 rdev 2/6120 fsid 75be00000000 fileid 100000000000 a/m/ctime 4096.000000 0.000000 2049.000000
15:35:13.475533 IP (tos 0x0, ttl 64, id 32009, offset 0, flags [DF], proto TCP (6), length 52)
    10.70.10.108.896 > 10.70.10.110.2049: Flags [.], cksum 0x298c (incorrect -> 0xa946), seq 985, ack 1533, win 501, options [nop,nop,TS val 2189480641 ecr 1164566737], length 0
15:35:13.475913 IP (tos 0x0, ttl 64, id 32010, offset 0, flags [DF], proto TCP (6), length 200)
    10.70.10.108.896 > 10.70.10.110.2049: Flags [P.], cksum 0x2a20 (incorrect -> 0x7380), seq 985:1133, ack 1533, win 501, options [nop,nop,TS val 2189480642 ecr 1164566737], length 148: NFS request xid 1749065713 144 write fh Unknow/010800008C001E00000000008C001E0000000000051F1396 1 (0) bytes @ 10921792046326874112 <#21>
15:35:13.476270 IP (tos 0x0, ttl 64, id 44638, offset 0, flags [DF], proto TCP (6), length 52)
    10.70.10.110.2049 > 10.70.10.108.896: Flags [.], cksum 0xa8b0 (correct), seq 1533, ack 1133, win 502, options [nop,nop,TS val 1164566737 ecr 2189480642], length 0
15:35:13.499183 IP (tos 0x0, ttl 64, id 44639, offset 0, flags [DF], proto TCP (6), length 216)
    10.70.10.110.2049 > 10.70.10.108.896: Flags [P.], cksum 0x9d56 (correct), seq 1533:1697, ack 1133, win 502, options [nop,nop,TS val 1164566760 ecr 2189480642], length 164: NFS reply xid 1749065713 reply ok 160 create fh / dir attr: PRE: sz 1749065713 mtime 0.000001 ctime 1.033277 POST: unk-ft 6120  72676 ids 21/0 sz 17592186044416 nlink 0 rdev 2049/0 fsid 1e008c6840683a fileid 68409ff1 a/m/ctime 0.1749065713 0.000021 2.2466250752
15:35:13.499215 IP (tos 0x0, ttl 64, id 32011, offset 0, flags [DF], proto TCP (6), length 52)
    10.70.10.108.896 > 10.70.10.110.2049: Flags [.], cksum 0x298c (incorrect -> 0xa7df), seq 1133, ack 1697, win 501, options [nop,nop,TS val 2189480665 ecr 1164566760], length 0
15:35:14.500786 IP (tos 0x0, ttl 64, id 32012, offset 0, flags [DF], proto TCP (6), length 200)
    10.70.10.108.896 > 10.70.10.110.2049: Flags [P.], cksum 0x2a20 (incorrect -> 0x6800), seq 1133:1281, ack 1697, win 501, options [nop,nop,TS val 2189481667 ecr 1164566760], length 148: NFS request xid 1749065714 144 create fh Unknow/0108000089001E000000000089001E0000000000041F1396  [|nfs]
15:35:14.501141 IP (tos 0x0, ttl 64, id 44640, offset 0, flags [DF], proto TCP (6), length 52)
    10.70.10.110.2049 > 10.70.10.108.896: Flags [.], cksum 0x9f77 (correct), seq 1697, ack 1281, win 501, options [nop,nop,TS val 1164567762 ecr 2189481667], length 0
15:35:14.501458 IP (tos 0x0, ttl 64, id 44641, offset 0, flags [DF], proto TCP (6), length 324)
    10.70.10.110.2049 > 10.70.10.108.896: Flags [P.], cksum 0xf9a3 (correct), seq 1697:1969, ack 1281, win 501, options [nop,nop,TS val 1164567763 ecr 2189481667], length 272: NFS reply xid 1749065714 reply ok 268 create fh Unknow/010800008D001E00000000008D001E0000000000051F1396 REG 1 ids 1/6120 sz 129458904236032 nlink 33277 rdev 0/0 fsid 0 fileid 80100000000 a/m/ctime 1966221.1749051451 0.1749065714 0.1749065714 dir attr: PRE: POST: NON 10000 ids 0/1749051451 sz 1 nlink 1749051451 rdev 2/6120 fsid 75be00000000 fileid 100000000000 a/m/ctime 4096.000000 0.000000 2049.000000
15:35:14.501483 IP (tos 0x0, ttl 64, id 32013, offset 0, flags [DF], proto TCP (6), length 52)
    10.70.10.108.896 > 10.70.10.110.2049: Flags [.], cksum 0x298c (incorrect -> 0x9e66), seq 1281, ack 1969, win 501, options [nop,nop,TS val 2189481667 ecr 1164567763], length 0
15:35:14.501947 IP (tos 0x0, ttl 64, id 32014, offset 0, flags [DF], proto TCP (6), length 200)
    10.70.10.108.896 > 10.70.10.110.2049: Flags [P.], cksum 0x2a20 (incorrect -> 0x659d), seq 1281:1429, ack 1969, win 501, options [nop,nop,TS val 2189481668 ecr 1164567763], length 148: NFS request xid 1749065714 144 write fh Unknow/010800008D001E00000000008D001E0000000000051F1396 1 (0) bytes @ 10922073521303584768 <#21>
15:35:14.545547 IP (tos 0x0, ttl 64, id 44642, offset 0, flags [DF], proto TCP (6), length 52)
    10.70.10.110.2049 > 10.70.10.108.896: Flags [.], cksum 0x9da5 (correct), seq 1969, ack 1429, win 501, options [nop,nop,TS val 1164567807 ecr 2189481668], length 0
15:35:14.549982 IP (tos 0x0, ttl 64, id 44643, offset 0, flags [DF], proto TCP (6), length 216)
    10.70.10.110.2049 > 10.70.10.108.896: Flags [P.], cksum 0x9257 (correct), seq 1969:2133, ack 1429, win 501, options [nop,nop,TS val 1164567811 ecr 2189481668], length 164: NFS reply xid 1749065714 reply ok 160 create fh / dir attr: PRE: sz 1749065714 mtime 0.000001 ctime 1.033277 POST: unk-ft 6120  72676 ids 21/0 sz 17592186044416 nlink 0 rdev 2049/0 fsid 1e008d6840683b fileid 68409ff2 a/m/ctime 0.1749065714 0.000021 2.2466250752
15:35:14.550014 IP (tos 0x0, ttl 64, id 32015, offset 0, flags [DF], proto TCP (6), length 52)
    10.70.10.108.896 > 10.70.10.110.2049: Flags [.], cksum 0x298c (incorrect -> 0x9ccd), seq 1429, ack 2133, win 501, options [nop,nop,TS val 2189481716 ecr 1164567811], length 0
15:35:15.551444 IP (tos 0x0, ttl 64, id 32016, offset 0, flags [DF], proto TCP (6), length 52)
    10.70.10.108.896 > 10.70.10.110.2049: Flags [F.], cksum 0x298c (incorrect -> 0x98e3), seq 1429, ack 2133, win 501, options [nop,nop,TS val 2189482717 ecr 1164567811], length 0
15:35:15.551553 IP (tos 0x0, ttl 64, id 49722, offset 0, flags [DF], proto TCP (6), length 148)
    10.70.10.108.663 > 10.70.10.110.2049: Flags [P.], cksum 0x29ec (incorrect -> 0x7d89), seq 97:193, ack 69, win 502, options [nop,nop,TS val 2189482717 ecr 1164564662], length 96: NFS request xid 1749065715 92 lookup fh Unkno/2F7372762F6E66732F7368617265646661726964  [|nfs]
15:35:15.551922 IP (tos 0x0, ttl 64, id 18989, offset 0, flags [DF], proto TCP (6), length 52)
    10.70.10.110.2049 > 10.70.10.108.663: Flags [.], cksum 0x2c75 (correct), seq 69, ack 193, win 509, options [nop,nop,TS val 1164568813 ecr 2189482717], length 0
15:35:15.551922 IP (tos 0x0, ttl 64, id 18990, offset 0, flags [DF], proto TCP (6), length 80)
    10.70.10.110.2049 > 10.70.10.108.663: Flags [P.], cksum 0xa403 (correct), seq 69:97, ack 193, win 509, options [nop,nop,TS val 1164568813 ecr 2189482717], length 28: NFS reply xid 1749065715 reply ok 24 lookup [|nfs]
15:35:15.551922 IP (tos 0x0, ttl 64, id 44644, offset 0, flags [DF], proto TCP (6), length 52)
    10.70.10.110.2049 > 10.70.10.108.896: Flags [F.], cksum 0x94f8 (correct), seq 2133, ack 1430, win 501, options [nop,nop,TS val 1164568813 ecr 2189482717], length 0
15:35:15.551952 IP (tos 0x0, ttl 64, id 49723, offset 0, flags [DF], proto TCP (6), length 52)
    10.70.10.108.663 > 10.70.10.110.2049: Flags [.], cksum 0x298c (incorrect -> 0x2c5f), seq 193, ack 97, win 502, options [nop,nop,TS val 2189482718 ecr 1164568813], length 0
15:35:15.551972 IP (tos 0x0, ttl 64, id 32017, offset 0, flags [DF], proto TCP (6), length 52)
    10.70.10.108.896 > 10.70.10.110.2049: Flags [.], cksum 0x298c (incorrect -> 0x94f7), seq 1430, ack 2134, win 501, options [nop,nop,TS val 2189482718 ecr 1164568813], length 0
15:35:15.552086 IP (tos 0x0, ttl 64, id 49724, offset 0, flags [DF], proto TCP (6), length 52)
    10.70.10.108.663 > 10.70.10.110.2049: Flags [F.], cksum 0x298c (incorrect -> 0x2c5e), seq 193, ack 97, win 502, options [nop,nop,TS val 2189482718 ecr 1164568813], length 0
15:35:15.552353 IP (tos 0x0, ttl 64, id 18991, offset 0, flags [DF], proto TCP (6), length 52)
    10.70.10.110.2049 > 10.70.10.108.663: Flags [F.], cksum 0x2c55 (correct), seq 97, ack 194, win 509, options [nop,nop,TS val 1164568814 ecr 2189482718], length 0
15:35:15.552376 IP (tos 0x0, ttl 64, id 49725, offset 0, flags [DF], proto TCP (6), length 52)
    10.70.10.108.663 > 10.70.10.110.2049: Flags [.], cksum 0x298c (incorrect -> 0x2c5c), seq 194, ack 98, win 502, options [nop,nop,TS val 2189482718 ecr 1164568814], length 0

